Argument,Debate,Scheme
"While the United States has been relatively prosperous and successful for centuries, countries that presented themselves as 
alternatives to Capitalism dissolved, for example the Soviet Union.",Is capitalism the most moral system?,0
"Capitalism is the only economic system that allows individuals to be independent and autonomous in acting socially and
economically without the intrusion of government.",Is capitalism the most moral system?,2
"Capitalism, by virtue of the free market and a general lack of state intervention, enables more freedom than any comparable systems.",Is capitalism the most moral system?,2
"One of the foundations of capitalism is the idea that transactions should be voluntary and not imposed, as is the case for
 government-mandated taxes.",Is capitalism the most moral system?,1
Capitalism puts people under constant stress through the way it structures life.,Is capitalism the most moral system?,5
"Even though it causes stress, capitalism may still cause less stress than any alternative system.",Is capitalism the most moral system?,6
"Capitalism is based upon free trade, which has been found to make people nicer.",Is capitalism the most moral system?,4
Capitalism promotes co-operation.,Is capitalism the most moral system?,1
"Capitalism in its most basic form (the use of a common mean of value to make a trade) is morally neutral, because it's neither
 good nor bad.",Is capitalism the most moral system?,1
"Capitalism, by virtue of being the system which most closely adheres to natural selection, is the most moral system.",Is capitalism the most moral system?,1
"This is the naturalistic fallacy. By this reasoning, rape and murder are moral because they are also natural.",Is capitalism the most moral system?,7
Capitalism inevitably leads to various forms of exploitation.,Is capitalism the most moral system?,5
"Capitalism does not take externalities into account, many of which are devastating to both people and the environment.",Is capitalism the most moral system?,5
Pollution and the usage of fossil fuels would be examples of this.,Is capitalism the most moral system?,0
Capitalism treats people as equals.,Is capitalism the most moral system?,1
"And neither in risk. If the company fails the employee only loses their job, while the employer might lose their entire life savings
 and go bankrupt.",Is capitalism the most moral system?,1
"Losing one's job has a higher probability of leading to bankruptcy, homelessness and starvation than losing one's business.",Is capitalism the most moral system?,0
"Capitalism, more than any other system put into thought or action, helps the poor.",Is capitalism the most moral system?,2
Incentivizing moral behavior is de facto an ok thing to do because it causes more moral behavior to take place.,Is it ok to incentivise moral behavior?,2
Bought morality is not morality. Incentivising moral behavior reduces ethics to the category of compliance.,Is it ok to incentivise moral behavior?,5
"By reducing ethics to behavioral inducements, the system devalues the ethicality of all actions, regardless of their objective desirability. Source",Is it ok to incentivise moral behavior?,5
Being paid to behave morally is not the right reason to do so.,Is it ok to incentivise moral behavior?,1
"A person may do the right thing without an incentive being necessary, however it may be perceived as just an added perk.",Is it ok to incentivise moral behavior?,3
Paying someone for morality is like paying a bribe.,Is it ok to incentivise moral behavior?,7
"Since what is morally correct is subjective, incentivising morally correct behaviour is no different that incentivising morally incorrect behavior.",Is it ok to incentivise moral behavior?,7
"Using a promotion as an incentive for treating customers well can help a business's reputation, thus making it mutually beneficial.",Is it ok to incentivise moral behavior?,2
"Rewarding customer service employees, for example, may improve the quality of service provided to customers. This can then create a favorable reputation for the business.",Is it ok to incentivise moral behavior?,0
Morality is not objectively measurable so incentivising it effectively is not possible.,Is it ok to incentivise moral behavior?,3
A group of people (e.g. an ethics committee) could be a good judge.,Is it ok to incentivise moral behavior?,0
Morality is objective.  (link to other kialo debate),Is it ok to incentivise moral behavior?,4
"One can measure certain good deeds quantitatively, such as the amount of money donated or the number of people helped over the street.",Is it ok to incentivise moral behavior?,0
The intrinsic value of morality is lower than the practical value of ensuring consistent moral behaviour throughout society.,Is it ok to incentivise moral behavior?,1
Societies do not punish people that would love to steal something but aren't capable of executing the heist.,Is it ok to incentivise moral behavior?,7
Moral behaviour is relative; sociologically driven reinforcement of 'correct' behaviour is helpful.,Is it ok to incentivise moral behavior?,1
Moral behaviour is not something which is inherent to human beings and needs to be taught. Helping people improve their moral behaviour should therefore be commended.,Is it ok to incentivise moral behavior?,1
"Children are taught the difference between right and wrong by their parents. Without this guidance, they would behave in a manner that is more in alignment with instinct than moral correctness.",Is it ok to incentivise moral behavior?,3
Moral behavior's inherency to human nature is irrelevant to whether or not incentivizing moral behavior is good.,Is it ok to incentivise moral behavior?,1
"The only one that can properly evaluate the morality of an action is the person performing the action.
Therefore, incentivising the behaviour can only be done subjectively.
",Is it ok to incentivise moral behavior?,3
"Some people get to be known for their moral attitude and impactful choices not only by themselves and their colleagues, but also get recognised as morally good by wider population. Virtue of those could be easily recognised and rewarded.",Is it ok to incentivise moral behavior?,1
Not being punished for rule-breaking and enjoying the liberties and benefits of not being incarcerated are equivalent to directly incentivizing good behavior.,Is it ok to incentivise moral behavior?,7
"As incentives are usually scarce, this will lead to competition. People competing for morality is not ok.",Is it ok to incentivise moral behavior?,3
Competition means you can either make yourself look good or others look bad. This is not good for overall morality.,Is it ok to incentivise moral behavior?,1
Incentivising moral behaviour sends a clear message that morality is valued.,Is it ok to incentivise moral behavior?,3
Behaving ethically should be the “ticket of admission” for even having a job Source,Is it ok to incentivise moral behavior?,4
Incentivising moral behavior is the easiest way to get people to do the right thing.,Is it ok to incentivise moral behavior?,2
"If doing the right thing is costly, it would be good to compensate.",Is it ok to incentivise moral behavior?,2
Whistle-blowers often pay a high price for doing the right thing. This is very discouraging for other potential whistle-blowers. Compensation would mitigate this effect.,Is it ok to incentivise moral behavior?,0
The perspective of compensation might encourage false cases of whistle-blowing.,Is it ok to incentivise moral behavior?,5
It might make whistle-blowing an interesting tool for employees who hold a grudge against their employer.,Is it ok to incentivise moral behavior?,5
A one-size-fits-all prescription to good health is both ideologically and practically dangerous.,Do people have a right to not wear a mask in public spaces during the Covid-19 pandemic?,1
"The UK government has made exceptions to the rule requiring masks for specific groups of people.
 This is an acknowledgement of the practical dangers of a one-size-fits-all prescription.",Do people have a right to not wear a mask in public spaces during the Covid-19 pandemic?,3
It is not reasonable for everyone to wear masks.,Do people have a right to not wear a mask in public spaces during the Covid-19 pandemic?,1
"For people with certain underlying conditions and medical considerations, mask wearing is not possible.",Do people have a right to not wear a mask in public spaces during the Covid-19 pandemic?,3
"Many rape survivors, for whom wearing a mask can trigger trauma and flashbacks, are being stigmatized for not wearing masks.",Do people have a right to not wear a mask in public spaces during the Covid-19 pandemic?,0
"Mandating mask-wearing during a pandemic is like mandating safety/hand brakes on a car. It may never be required
 but is in everyone’s interest that it is there and working if it is required.",Do people have a right to not wear a mask in public spaces during the Covid-19 pandemic?,7
COVID-19 is universally transmitted through infected secretions and through respiratory droplets. ,Do people have a right to not wear a mask in public spaces during the Covid-19 pandemic?,3
"During a world pandemic, it is important to be guided by those who are more informed than we are.",Do people have a right to not wear a mask in public spaces during the Covid-19 pandemic?,1
"While certain attributes of the virus are still being investigated, the overwhelming consensus is that the wearing of masks will limit the spread of the virus.",Do people have a right to not wear a mask in public spaces during the Covid-19 pandemic?,4
Educating people will more effectively guide them to make responsible decisions regarding mask-wearing.,Do people have a right to not wear a mask in public spaces during the Covid-19 pandemic?,6
"Mandatory face mask wearing, and the undercutting of people's rights not to wear one, provoked protests in Spain.",Do people have a right to not wear a mask in public spaces during the Covid-19 pandemic?,0
"In many places, such as Florida, mask wearing is not mandatory, and yet there have been protests 
(https://abc7news.com/viral-target-anti-mask-video-protesters-parade-around-store-demand-customers-remove-face-masks-rant-caught-on/6428893/).",Do people have a right to not wear a mask in public spaces during the Covid-19 pandemic?,0
"Most anti-maskers are not educated on the benefits of wearing masks; whereas government officials 
and researchers who recommend masks to the point of making it mandatory are much more informed.",Do people have a right to not wear a mask in public spaces during the Covid-19 pandemic?,4
"Statistical modeling studies of mortality rate shows that masks significantly reduce the loss of life.",Do people have a right to not wear a mask in public spaces during the Covid-19 pandemic?,4
Wearing facemasks help prevent the spread of COVID-19.,Do people have a right to not wear a mask in public spaces during the Covid-19 pandemic?,2
A systematic review of 172 studies revealed that masks are effective at protecting people form COVID-19.,Do people have a right to not wear a mask in public spaces during the Covid-19 pandemic?,4
"Now that research has demonstrated its definite benefits, the CDC website officially recommends that masks be worn.",Do people have a right to not wear a mask in public spaces during the Covid-19 pandemic?,4
People's choice to not wear a mask must be respected.,Do people have a right to not wear a mask in public spaces during the Covid-19 pandemic?,1
People have the right to bodily autonomy and integrity. They should not be forced to wear masks if they don't wish to.,Do people have a right to not wear a mask in public spaces during the Covid-19 pandemic?,1
"The Jacobsen v. Massachusetts case in the US shows that masks do not violate the constitutional right to bodily integrity 
because they are required to protect public health.",Do people have a right to not wear a mask in public spaces during the Covid-19 pandemic?,4
This right to bodily autonomy is not without limits. Prostitution is illegal in many countries.,Do people have a right to not wear a mask in public spaces during the Covid-19 pandemic?,0
"The government has a moral obligation to reasonably restrict personal choices, especially ones that harm the public good.",Do people have a right to not wear a mask in public spaces during the Covid-19 pandemic?,1
Not wearing a mask can constitute self-harm and the state is obligated to prevent such harm by limiting choice.,Do people have a right to not wear a mask in public spaces during the Covid-19 pandemic?,7
"Individual choice of clothing is already restricted by laws prohibiting ""indecent exposure"", so it is not uncommon that the government regulates 
what people are allowed to wear (or not wear).",Do people have a right to not wear a mask in public spaces during the Covid-19 pandemic?,7
"If people's choices cause harm to other people, their choices should be restricted.",Do people have a right to not wear a mask in public spaces during the Covid-19 pandemic?,1
It is very well accepted that certain liberties should be curtailed where they would affect other people - consider the illegality of murder and theft.,Do people have a right to not wear a mask in public spaces during the Covid-19 pandemic?,7
"For most people, wearing a mask poses no risk. It is therefore justified that people are required to wear a mask 
since it does no harm to people wearing them but reduces harm for others and oneself.",Do people have a right to not wear a mask in public spaces during the Covid-19 pandemic?,2
"Public health has long been used as a justification to curtail civil liberties, such as mandatory quarantine for those with yellow fever in 1799.",Do people have a right to not wear a mask in public spaces during the Covid-19 pandemic?,0
Many people do not wear facemasks properly. This could increase the risk of infection to oneself or others.,Do people have a right to not wear a mask in public spaces during the Covid-19 pandemic?,5
A study has shown that people wearing a mask are less likely to touch their faces than those who don't wear a mask.,Do people have a right to not wear a mask in public spaces during the Covid-19 pandemic?,4
"Even if some people wear masks incorrectly, the net effect of wearing masks is still positive.",Do people have a right to not wear a mask in public spaces during the Covid-19 pandemic?,2
Even the WHO advice on masks has changed over time.,Do people have a right to not wear a mask in public spaces during the Covid-19 pandemic?,0
Schools should close during the Covid-19 pandemic because that would reduce the rate of infection of Covid-19.,Should schools close during the Covid-19 pandemic?,2
Schools can reduce cohort sizes to decrease the chances of widespread Covid-19 transmission.,Should schools close during the Covid-19 pandemic?,4
School closures negatively impact students' academic performance.,Should schools close during the Covid-19 pandemic?,5
"A study showed that, when students return to school, they will only have 63 to 68% of the learning gains in reading and 37 to 50% of the learning
 gains in mathematics relative to the average school year.",Should schools close during the Covid-19 pandemic?,4
A study found that students learn better when studying from home.,Should schools close during the Covid-19 pandemic?,4
Remote learning is a good substitute for in-person education.,Should schools close during the Covid-19 pandemic?,4
"First of all, school closures reduce the risk of illness. And it hardly affects the quality of education (at school) or, on the contrary, improves, because you can watch webinars.",Should schools close during the Covid-19 pandemic?,2
Many students have been thriving in remote education due to the ability to self-pace.,Should schools close during the Covid-19 pandemic?,0
Online schooling does not allow for an accurate assessment of the progress of students.,Should schools close during the Covid-19 pandemic?,5
Students in remote learning programs tend to score lower than those engaging in in-person education.,Should schools close during the Covid-19 pandemic?,5
Schools are critical for the social development of students.,Should schools close during the Covid-19 pandemic?,5
Students can take part in social activities online.,Should schools close during the Covid-19 pandemic?,6
"Kids don't play a significant role in the spread of Covid-19. Therefore, closing schools will not significantly reduce the spread of the virus.",Should schools close during the Covid-19 pandemic?,3
Students can wear masks and practise social distancing to reduce the rate of infection.,Should schools close during the Covid-19 pandemic?,6
Schools can reduce cohort sizes to decrease the chances of widespread Covid-19 transmission.,Should schools close during the Covid-19 pandemic?,6
A study found that Covid-19 cases in schools were 37% less than the ones in the surrounding community.,Should schools close during the Covid-19 pandemic?,4
"Scientists showed that 1 in 3 people that have COVID-19 won't show symptoms, and would thus continue to go outside and spread the virus without even knowing.",Should schools close during the Covid-19 pandemic?,4
Schools can reduce cohort sizes to decrease the chances of widespread Covid-19 transmission.,Should schools close during the Covid-19 pandemic?,6
It is much more difficult to ensure that students are present and engaged in classes when they are conducted remotely.,Should schools close during the Covid-19 pandemic?,5
90% of teachers surveyed in May 2020 in the US said that remote attendance did not approach normal attendance levels.,Should schools close during the Covid-19 pandemic?,0
Data suggested that only 60 percent of low-income students were regularly logging into online instruction early in the Covid-19 pandemic.,Should schools close during the Covid-19 pandemic?,0
Attendance is difficult to monitor when classes are conducted remotely.,Should schools close during the Covid-19 pandemic?,3
Students can ignore classes and leave them running in the background while they do other activities.,Should schools close during the Covid-19 pandemic?,0
This [30] can be avoided by requiring students to turn on their cameras.,Should schools close during the Covid-19 pandemic?,0
Students may not have enough personal space to be able to turn on their cameras comfortably.,Should schools close during the Covid-19 pandemic?,0
Students may not have stable enough (or any) internet connections for them to switch on their cameras.,Should schools close during the Covid-19 pandemic?,0
Students can get the materials for their school work via the computer.,Should schools close during the Covid-19 pandemic?,0
Only 54% of the global population has access to the internet (p. 8).,Should schools close during the Covid-19 pandemic?,4
"In the US, 4.4 million students cannot consistently access computers and thus, online learning.",Should schools close during the Covid-19 pandemic?,4
Many governments are taking measures to improve internet access for students.,Should schools close during the Covid-19 pandemic?,0
"In order to improve access to the internet, the government of Panama made the internet free for four months (p. 4).",Should schools close during the Covid-19 pandemic?,0
School isn't just about materials alone but also about personal contact and interaction.,Should schools close during the Covid-19 pandemic?,1
A decline in the quality of assessment is detrimental may result in a student's abilities to be misrepresented and thus may harm their future educational prospects.,Should schools close during the Covid-19 pandemic?,5
Students won't get help for exams. Students that are in low sets and need help from the teachers for every lesson will have no help with exam preparation and would go into the exam without any help.,Should schools close during the Covid-19 pandemic?,0
There are multiple online assessment methods that can be combined in order to accurately track the progress of students.,Should schools close during the Covid-19 pandemic?,6
School closures are detrimental to students' well-being.,Should schools close during the Covid-19 pandemic?,5
"Schools provide important benefits for students, particularly those from low-income families, that would be disrupted by school closures.",Should schools close during the Covid-19 pandemic?,5
School closures have been linked to an increase in child marriages across the world.,Should schools close during the Covid-19 pandemic?,5
"School closures disrupt students' routines, increase rates of anxiety and depression among them.",Should schools close during the Covid-19 pandemic?,5
Contracting Covid-19 or spreading it to family members would be worse for a student's well-being.,Should schools close during the Covid-19 pandemic?,6
It is unethical to employ people without economic compensation.,Should unpaid internships be banned?,1
Unpaid internships are an unfair way to replace paid workers.,Should unpaid internships be banned?,1
"The UN Declaration of Human Rights, Article 23 (3) states: “Everyone who works has the right to just and favourable remuneration.”",Should unpaid internships be banned?,4
"In the long run, the experience gained from an unpaid internship can lead one to have a career where they earn more money.",Should unpaid internships be banned?,2
"In the UK, people who have done unpaid internships have a higher average salary than those who have not (Sutton Trust, pp. 44-45).",Should unpaid internships be banned?,0
"Those people who have done paid internships gain an ever higher salary than those who have done unpaid internships (Sutton Trust, pp. 44-45). Therefore in 
terms of best promoting individual's longer-term salary, ideally unpaid internships would be banned and everyone would do paid internships.",Should unpaid internships be banned?,0
"There may never be enough paid internships to go around. Therefore if unpaid internships were banned, some people would never be able to gain the long-term benefits of an internship.",Should unpaid internships be banned?,5
Banning unpaid internships would not necessarily mean they would be replaced with paid internships meaning there would be less opportunities existing.,Should unpaid internships be banned?,5
People choose to opt into internships. If they feel it is in their interests they should be free to choose to do so.,Should unpaid internships be banned?,1
Unpaid internships lower the value placed on work done by other paid interns and entry level workers.,Should unpaid internships be banned?,1
When work is done without payment it makes similar work seem worth less.,Should unpaid internships be banned?,1
Where work is seen as less valuable this drives wages for those jobs down.,Should unpaid internships be banned?,3
Unpaid internships have replaced many entry-level jobs.,Should unpaid internships be banned?,3
Changing paid jobs for unpaid internships is harmful for the economy since those positions should have paid taxes.,Should unpaid internships be banned?,5
"Many paid or unpaid internships are never advertised and instead offered through informal networks, which encourages nepotism.",Should unpaid internships be banned?,3
72% of privileged young adults in the UK admit they secured their internships through family connections.,Should unpaid internships be banned?,0
This [24] is not sufficient reason to ban unpaid internships. It is only sufficient reason to regulate them such that they must be allocated on the basis of merit.,Should unpaid internships be banned?,6
There are more effective methods to deal with the problems of unpaid internships than a ban.,Should unpaid internships be banned?,6
"Governments could introduce regulations to ensure that unpaid interns are entitled to the same rights as employees in relation to discrimination, harassment and working conditions.",Should unpaid internships be banned?,2
Governments could cap the length of unpaid internships.,Should unpaid internships be banned?,4
"Effectiveness is not the only measure to consider. Other methods may be more difficult or more expensive to implement, may be easier to bypass, or come with undesirable collateral effects.",Should unpaid internships be banned?,6
Unpaid internships are a barrier to greater social equality in society.,Should unpaid internships be banned?,5
Unpaid internships are a barrier to social mobility.,Should unpaid internships be banned?,3
Unpaid internships serve as a mechanism for wealthier individuals to maintain socio-economic class advantage.,Should unpaid internships be banned?,5
Many interns have bought their place on unpaid internships.,Should unpaid internships be banned?,0
"Unpaid internships are difficult to regulate and monitor, often resulting in illegal practices.",Should unpaid internships be banned?,5
"Unpaid internships, in countries such as Australia, are often under legislated, allowing employers to bypass fair work requirements.",Should unpaid internships be banned?,0
Malpractice is not limited to unpaid internships. Paid interns at top companies can be subject to extreme conditions.,Should unpaid internships be banned?,0
Internships are becoming increasingly regulated to ensure standards.,Should unpaid internships be banned?,4
Unpaid internships can pave the way for a good career.,Should unpaid internships be banned?,2
Unpaid internships are a good way for young professionals to gain work experience.,Should unpaid internships be banned?,2
"If drugs were legalised, the drug trade would be less able to fuel serious crime.",Should all drugs be legalized? ,2
"Around half of the total income of criminal organisations comes from illicit drug trafficking. Without this, they would lose significant power.",Should all drugs be legalized? ,4
