Argument,Debate,Scheme
Euthanasia can end unnecessary suffering.,Should euthanasia be legalized?,2
"In situations of great chronic pain, euthanasia should be an option for patients.",Should euthanasia be legalized?,0
Chronic pain changes a person's psychological state to the point where their decision process is so impaired that they cannot make a rational decision on euthanasia.,Should euthanasia be legalized?,3
Less than 33% of patients requesting euthanaisa experience inadequate pain control.,Should euthanasia be legalized?,4
"Some doctors have argued that patients suffering from ""treatement-resistant"" depression should be allowed to elect for euthanasia.",Should euthanasia be legalized?,4
"Much of the suffering of those who request euthanasia, can be relieved simply with better palliative care.",Should euthanasia be legalized?,6
To let someone suffer until death is just as bad as murder.,Should euthanasia be legalized?,7
It could be considered to be worse than murder since it is torturing for a long time when murder stops life and automatically with it all pain and any more suffering.,Should euthanasia be legalized?,1
"The people most likely to be considered as candidates for euthanasia are those least likely to be able to speak for themselves (e.g. dementia, brain damage, neurodegenerative disorders).",Should euthanasia be legalized?,0
Safeguards would likely be put in place.,Should euthanasia be legalized?,3
"Countries, like Canada, use checks like requiring people to be ""mentally competent"" and ""suffering intolerably"".",Should euthanasia be legalized?,0
The current medical standards in countries with legal euthanasia are too easily attainable.,Should euthanasia be legalized?,0
"States such as Oregon have ""Death with Dignity"" regulations that set the standards for a person to become eligible for euthanasia.",Should euthanasia be legalized?,0
Quality of life is something too difficult to compute and can not be valued or 'measured' neither by experts since it involves feelings.,Should euthanasia be legalized?,1
"This is our life, therefore we should be able to decide when to end it.",Should euthanasia be legalized?,1
The ability to choose when we die is an integral part of our human freedom.,Should euthanasia be legalized?,1
God gave life so only he can take it.,Should euthanasia be legalized?,4
"Deuteronomy 32:29 states, ""It is I who bring both death and life.""",Should euthanasia be legalized?,4
"Certain deities (e. g. Moloch, Kukulkan) even fancy human sacrifice.",Should euthanasia be legalized?,0
Euthanasia is a selfish act.,Should euthanasia be legalized?,1
Euthanasia is assisted suicide and suicide is a rejection of the value of the life of the patient and those of everyone who cares about them.,Should euthanasia be legalized?,7
"Ethically, doctors should not do anything to a patient that will not benefit them.",Should euthanasia be legalized?,1
"Euthanasia does not necessarily have to be performed by doctors or nurses, and as such the guiding morality doesn't necessarily spring from the hippocratic oath.",Should euthanasia be legalized?,6
Legal euthanasia is better than alternatives for those seeking to end their lives.,Should euthanasia be legalized?,6
Legalised euthanasia is safer than forcing people to seek the alternative option themselves.,Should euthanasia be legalized?,2
Badly implemented suicides can cause direct collateral damage.,Should euthanasia be legalized?,6
Many who might look to end their lives through euthanasia might not end their lives where it is not legal.,Should euthanasia be legalized?,3
"In this study, of 56 attempted suicides, 55 were from falling and 1 gunshot wound, and many had significant injuries and an increased likeihood of further suicide attempts.",Should euthanasia be legalized?,0
People may be more inclined to favor euthanasia and make less effort to preserve their lives to the end.,Should euthanasia be legalized?,5
Legalised euthanasia is less stigmatising than suicide or the non-legal alternatives.,Should euthanasia be legalized?,1
"People should have the right to die with dignity when their dignity is violated by degrading living conditions; 
Therefore, euthanasia is not a violation of dignity of life, on the contrary it's the highest form of respect for it.",Should euthanasia be legalized?,1
"Life has no inherent value, so it cannot be devalued.",Should euthanasia be legalized?,1
"The cost of palliative care is extremely high, thus many people who opt for euthanasia are more likely to be poor.",Should euthanasia be legalized?,3
"In 2014, the Lithuanian health minister proposed that ""euthanasia might be needed for poor people who cannot access palliative care"".",Should euthanasia be legalized?,0
It is immoral to let people die simply because they cannot afford pain-relieving therapies. Palliative care should be made more accessible instead of legalizing euthanasia.,Should euthanasia be legalized?,1
"Humans have caused irreparable damage to the environment, and are causing constant harm, pain, and suffering to many other living organisms.
 All of this could be avoided if they didn't exist.",Would the world be a better place without humans?,2
"Without humans, animals and plants would be able to live and grow without the risks associated with human generated waste and anthropogenic climate change.",Would the world be a better place without humans?,2
Global warming would continue to exist; it exists regardless of the impact of humans.,Would the world be a better place without humans?,3
The impact of human activity has greatly exacerbated climate change (p. 1).,Would the world be a better place without humans?,4
"Without humans, a variety of species, habitats, and environments would have been changed by circumstances other than human influence and intervention. 
There is no guarantee that those natural changes would have been necessarily better than the changes caused by humans.",Would the world be a better place without humans?,3
The Earth would be able to heal and become a better place because the root cause for ecocide would simply not exist.,Would the world be a better place without humans?,2
The universe would be better without humans because humans are naturally selfish.,Would the world be a better place without humans?,1
Humans are the only ones that set aside stocks of resources for medium term use. This causes continued extraction/exploitation of the Earth in excess of current needs.,Would the world be a better place without humans?,3
"While humans and animals must consume to survive, human beings are immoral because they are intelligent enough to survive without killing yet continue
to harm other species.",Would the world be a better place without humans?,1
The universe probably isn't anthropocentric.,Would the world be a better place without humans?,1
"""Better"" is a value claim. The post-human universe may not make the same value judgement given that humans are an outcome of the evolving universe.",Would the world be a better place without humans?,1
"Selfishness has been associated with evolutionary advantages for many species, making the universe partially responsible for the selfishness of organisms that develop within it.",Would the world be a better place without humans?,3
The link between evolutionary selection and selfishness has been overturned due to recent findings that evolutionary pressures to cooperate and act selflessly are stronger.,Would the world be a better place without humans?,4
"Nature causes irreparable damage to itself as well as constant harm, pain, and suffering to other living organisms without any help from humans.
 None of this can be avoided without humans.",Would the world be a better place without humans?,3
Whenever human populations expand they take more land away from wild habitats which heavily restricts the freedom of all living organisms in that habitat often leading to many deaths as well.,Would the world be a better place without humans?,0
"Domesticated animals have no natural freedoms, they are almost entirely stripped away for the purpose of production for humans",Would the world be a better place without humans?,0
Humans also provide a habitat for billions of living organisms that reside in our bodies. Many of these creatures would go extinct without humans.,Would the world be a better place without humans?,2
"Not all animals suffer or feel pain, and thus cannot feel the effects of a loss of autonomy.",Would the world be a better place without humans?,3
"Suffering should be put in the context of the complexity of the nervous system. Animals tend to have less complex nervous systems than human beings,
 which implies that they have a reduced capacity for suffering.",Would the world be a better place without humans?,3
Scientists studying other creatures are constantly discovering how much more complex other life forms are than previously assumed.,Would the world be a better place without humans?,4
"Many cephalopods, decapods, and other invertebrates feel pain, debunking the previous understanding of their nature.",Would the world be a better place without humans?,0
All of humanity need not necessarily contribute to a cataclysmic event. It only takes a handful of individuals to use nuclear weapons for most life to be destroyed on the planet.,Would the world be a better place without humans?,3
"Value judgements are only relevant for human beings who assign value, meaning that the Earth cannot be better or worse without human beings to make value judgments about it.",Would the world be a better place without humans?,1
If the world would be better or worse is subjective as those things aren't intrinsic qualities of something.,Would the world be a better place without humans?,1
"There are general or pragmatic standards for Earthly wellness, like the stability of weather patterns or the preservation of species, that could be adopted without falling into naive subjectivism.",Would the world be a better place without humans?,1
"If the species making such a judgement does not exist and therefore cannot ascertain a value, it is impossible for the Earth to be better off.",Would the world be a better place without humans?,3
"The point of judging our existence on Earth is for humans to decide whether or not our presence is better than our absence. The question is an internal reflection, not outwardly asking the Earth itself.",Would the world be a better place without humans?,1
Removing humans from the picture would most likely benefit the remaining conscious beings on the planet.,Would the world be a better place without humans?,2
"All human suffering would be eliminated without humans. In this manner, the world would in fact be better, even if only in the eyes of the humans who lived prior to their extinction.",Would the world be a better place without humans?,2
"Humans are the most advanced species that has ever been on Earth, and humanity is still evolving. Removing humanity from existence would eliminate this progress.",Would the world be a better place without humans?,5
"Humans might be the most advanced species in the entire universe. If humanity did not exist, the universe could lose the species with the most advanced consciousness.",Would the world be a better place without humans?,3
"In near future, humanity could develop a reliable technological ability to protect the planet and life from extinction events.",Would the world be a better place without humans?,2
"Humans have created a unique set of values, cultures, and traditions in a way that only they could. To say the world would be a better place without humans is to fail to take into account the complex and rich culture of every human society.",Would the world be a better place without humans?,0
These technological advancements have no inherent value to the universe and are only of limited value to humans.,Would the world be a better place without humans?,1
"Just because humans are the most advanced species, doesn't mean we make the Earth better. We are too smart for our own good- we create factories and cars and such that just destroy our atmosphere.",Would the world be a better place without humans?,0
Removing humans means giving chance for new intelligent life to develop.,Would the world be a better place without humans?,2
"In the cosmic perspective of life, there is no absolute sense of ""good"" and ""bad"".That's a human-created concept that wouldn't matter if humans were eradicated. Therefore, it makes humanity's existence irrelevant.",Would the world be a better place without humans?,1
Retrocausality is possible in some interpretations of quantum physics.,Free Will or Determinism: Do we have free will?,0
"Retrocausation provides a viable alternative to the problematic superdeterminism vs. 
action-at-a-distance debate by preserving local causation (link).",Free Will or Determinism: Do we have free will?,4
"The laws of physics, as we know them, are either deterministic or fundamentally random. In both cases,
 they are out of our control.",Free Will or Determinism: Do we have free will?,3
"The laws of physics are probabilistic, meaning that events and motivations merely change the distribution of possible 
outcomes and choices, but don't necessarily determine them.",Free Will or Determinism: Do we have free will?,3
"The Earth orbiting around the Sun was not compatible with our understanding of the mechanisms that govern the
 universe less than 500 years ago, yet is now accepted as fact.",Free Will or Determinism: Do we have free will?,0
"If entropy leads to universal randomness and randomness is the lack of all deterministic forces, then at least one part 
of a wholly deterministic universe is false, meaning there most be something else influencing the universe outside 
of determinism.",Free Will or Determinism: Do we have free will?,3
"The inexistence of free will cannot be scientifically proven as it would be impossible to put two distinct human 
beings in exactly the same conditions twice and observe their decisions.",Free Will or Determinism: Do we have free will?,3
"Determinism based on physical causation inherits the philosophical doubt about causality expressed most famously 
by Hume: we can't in the end tell the difference between ""A causes B"" and ""A happens then B happens"".",Free Will or Determinism: Do we have free will?,4
"By Occam's Razor, the simplest explanation for the lack of empirical evidence for the existence of free will
 is that free will does not exist.",Free Will or Determinism: Do we have free will?,4
Free will and determinism are not mutually exclusive because freedom and weak forms of determinism are compatible.,Free Will or Determinism: Do we have free will?,3
"Compatiblism is a widely held position within the academic community, which suggests that it is plausible in many
 different forms.",Free Will or Determinism: Do we have free will?,4
The consensus among academics lends reasonable credibility to the accuracy of a position relative to the general public.,Free Will or Determinism: Do we have free will?,4
"Debating necessarily involves the implicit assumption that it's possible in principle to change the minds of others 
involved. This is only possible if the participants are free in some sense.",Free Will or Determinism: Do we have free will?,0
"Computer programs can and have participated in a debate, yet lack free will.",Free Will or Determinism: Do we have free will?,0
"Free will could be like gravity, which is a set of assumptions that are only supported by our observations of 
how they impact other things.",Free Will or Determinism: Do we have free will?,7
"Current science falls short of explaining consciousness and personhood. Thus restricting the conversation to purely
 scientific description of the topic would leave the discussion incomplete.",Free Will or Determinism: Do we have free will?,0
"Unknowns and incompleteness are not problematic for the scientific process.
 Despite not fully understanding what the force of gravity is, scientific studies and models remain useful.",Free Will or Determinism: Do we have free will?,0
Life can't be given back. So the death penalty carries the risk of ruining innocent people lives.,Should the death penalty be abolished?,2
Research has estimated that many death row inmates were wrongly convicted and could have been exonerated.,Should the death penalty be abolished?,4
The death penalty negatively affects both the families of the victims as well as the defendant(s).,Should the death penalty be abolished?,2
The death penalty does not sufficiently punish criminals as they will not experience the long-term struggles of imprisonment.,Should the death penalty be abolished?,2
It is more humane to kill people than to restrain their liberty for life.,Should the death penalty be abolished?,6
"Restraining liberty is done to protect the well-being of others. Once someone is restrained, the decision to live or die should be theirs alone.",Should the death penalty be abolished?,1
"Killing someone is irreversible, whereas someone in prison can always commit suicide.",Should the death penalty be abolished?,5
"This manner of justice motivates and perpetuates violence and brutality. Death penalty often sends the wrong message ‘we kill people to
 show that killing is wrong’. If we are to advance as a society, then we have to move from the ‘an eye for an eye’ revenge mentality.",Should the death penalty be abolished?,1
Death penalty is not applied fairly in all countries.,Should the death penalty be abolished?,2
"The death penalty is often used in a disproportional manner against the poor, minorities and members of racial, ethnic, political and religious groups.",Should the death penalty be abolished?,4
No person has the moral authority to determine that another person deserves to die.,Should the death penalty be abolished?,1
Some crimes deserve the death penalty.,Should the death penalty be abolished?,1
"This Capital punishment does not address the root cause of the crime. Our focus should be on preventing crime rather than killing criminals 
and supporting violence.",Should the death penalty be abolished?,6
There are many examples of killing that are generally accepted as moral acts. Killing in battle is viewed as heroic.,Should the death penalty be abolished?,0
"The death penalty goes against our most basic human right, the right to life.",Should the death penalty be abolished?,1
"Since murder is justified in self defense, the right to life is not particularly sacred.",Should the death penalty be abolished?,7
It is cheaper for the society to execute people.,Should the death penalty be abolished?,2
It is immoral to value saving resources at the cost of the life of a human being.,Should the death penalty be abolished?,1
"With due process, it is objectively more expensive to seek the death penalty rather than life imprisonment.",Should the death penalty be abolished?,2
"If the death penalty was in regular use, improvements would be made and the cost would be lowered over time.",Should the death penalty be abolished?,6
The death sentence provides an effective deterrent in terms of stopping other people from committing the same crime.,Should the death penalty be abolished?,2
"Among the 25 states in the US with the highest murder rate, 20 have the death penalty.",Should the death penalty be abolished?,0
"In a study, 88.2% of criminology experts interviewed do not think that the death penalty deters murder.",Should the death penalty be abolished?,4
Giving a killer the death sentence will ensure that they do not do it again and hence saves innocent lives.,Should the death penalty be abolished?,2
Punishing people for crimes they might commit in the future is unethical.,Should the death penalty be abolished?,1
Long/life sentences already serve as a deterrent to crime.,Should the death penalty be abolished?,6
"Properly restraining a criminal ensures others will be safe, killing them is unnecessary and hypocritical.",Should the death penalty be abolished?,6
"Despite a wide variety of attempted measures, COVID-19 has continued to spread at a dangerous rate - vaccines are the best remaining option to protect and improve our lives.",Should Covid-19 vaccines be mandatory?,2
"Vaccines have eradicated diseases in the past, like rinderpest and smallpox (p. 4).",Should Covid-19 vaccines be mandatory?,0
"During the SARS outbreak, strong public health measures were able to sufficiently stop the spread of the virus without requiring vaccination.",Should Covid-19 vaccines be mandatory?,6
There has not been perfect enforcement of other measures. New Zealand's example proves that incidences of COVID-19 spread can be virtually eliminated without a vaccine.,Should Covid-19 vaccines be mandatory?,0
Vaccines are the least harmful way to mitigate the spread of COVID-19.,Should Covid-19 vaccines be mandatory?,2
Maintaining social distancing measures long-term could have severe impacts on the global economy and exacerbate harms to marginalized communities.,Should Covid-19 vaccines be mandatory?,5
Social distancing measures have an especially devastating impact on lives and livelihoods in developing countries.,Should Covid-19 vaccines be mandatory?,0
Technology and social innovations can help mitigate the harms of social distancing.,Should Covid-19 vaccines be mandatory?,3
"Any COVID-19 vaccine produced is unlikely to undergo the level of clinical testing necessary to confirm it is both safe, and effective.",Should Covid-19 vaccines be mandatory?,3
It is an infringement of the right to personal autonomy.,Should Covid-19 vaccines be mandatory?,1
"This would be unconstitutional based on freedom of privacy, and contrary to the constitutional principles arrived at in Roe vs Wade.",Should Covid-19 vaccines be mandatory?,4
It is a duty of the state to protect its citizens from life-threatening diseases such as COVID-19.,Should Covid-19 vaccines be mandatory?,1
"There is already a precedent for the state passing laws governing bodily choices in the name of public safety, such as banning the use of methamphetamine.",Should Covid-19 vaccines be mandatory?,7
"In some places in the US, healthcare workers are required to get vaccinated against the seasonal flu or to provide a reason for exemption from their physician.",Should Covid-19 vaccines be mandatory?,0
Forcing citizens to undergo a medical procedure against their will increases mistrust in public institutions and increases the influence of the anti-vaccination movement.,Should Covid-19 vaccines be mandatory?,5
The state should not mandate its citizens to undertake tasks that may carry a risk of harm.,Should Covid-19 vaccines be mandatory?,1
"Mandatory vaccinations can be enforced through non-state actors such as workplaces, stores and privately owned public spaces, which could require a proof of vaccination for entry.",Should Covid-19 vaccines be mandatory?,6
"Airlines sometimes require ""fitness to fly"" certificate from passengers flying with them. This could be extended to include proof of immunization from COVID-19.",Should Covid-19 vaccines be mandatory?,7
The quickest and safest way to develop herd immunity is through a mandatory vaccination policy.,Should Covid-19 vaccines be mandatory?,4
The possibility of reinfection has not yet been ruled out and would make attaining herd immunity practically impossible.,Should Covid-19 vaccines be mandatory?,3
"Due to growing anti-vaccination sentiment, it is unlikely that the government will be able to enforce mandatory vaccinations.",Should Covid-19 vaccines be mandatory?,3
Attaching vaccine requirements to attend schools or daycares have been shown to significantly increase the vaccination rate to herd immunity levels in the US (p. 269).,Should Covid-19 vaccines be mandatory?,0
Providing vaccinations to an entire population requires huge amounts of resources which can otherwise be used towards addressing more urgent public health issues.,Should Covid-19 vaccines be mandatory?,6
"Governments have given billions of taxpayers dollars to different drug companies to make the COVID-19 vaccine, much of which could be wasted if the vaccine doesn't work.",Should Covid-19 vaccines be mandatory?,5
"COVID-19 is the most urgent public health issue at the moment, and should therefore have priority.",Should Covid-19 vaccines be mandatory?,1
Mandatory vaccine policies have proved extremely helpful in the fight against other preventable illnesses.,Should Covid-19 vaccines be mandatory?,7
A mandatory vaccine policy would vastly increase already present inequalities in medical treatment.,Should Covid-19 vaccines be mandatory?,5
Differences over how to distribute the vaccine in a mandatory system will lead to some people being prioritized over others.,Should Covid-19 vaccines be mandatory?,3
"A mandatory vaccine policy would It will be easier for rich countries to access, produce and distribute COVID-19 vaccines. These countries will therefore recover faster from the pandemic. 
This will increase existing inequality in public health and economy between rich and poor countries.greatly increase competition between countries for supply, increasing the already inequitable distribution of vaccines throughout the world.",Should Covid-19 vaccines be mandatory?,3
Mandatory vaccination could result in rich countries hoarding vaccines for their population. This could make vaccines inaccessible or unaffordable for poorer countries.,Should Covid-19 vaccines be mandatory?,3
"A study of European countries discovered, ""Those [countries] where a vaccination is mandatory do not usually reach better coverage than neighbour or similar countries where there is no legal obligation.""",Should Covid-19 vaccines be mandatory?,4
