Argument,Debate,Scheme
Chronic psychological suffering means individuals with mental health disorders have a stronger desire to die than neurotypical people. It would be an injustice to deny them that choice.,Should individuals sentenced to life in prison be allowed to choose death instead?,1
"A 2006 survey showed 49% of state prisoners, 40% of federal prisoners and 60% of all inmates in the USA have a symptom of a mental disorder (p. 8).",Should individuals sentenced to life in prison be allowed to choose death instead?,4
"This argument suggests that individuals with mental health conditions cannot choose for themselves, which is an ableist assumption and is incorrect.",Should individuals sentenced to life in prison be allowed to choose death instead?,1
"As with assisted dying in medical circumstances, the use of safeguards can ensure that the prisoner makes an informed decision.",Should individuals sentenced to life in prison be allowed to choose death instead?,6
Medical practitioners follow scientific standards to determine whether patients possess autonomy and the capacity to make an informed choice. Such requirements could also be applied to prisoners in these circumstances.,Should individuals sentenced to life in prison be allowed to choose death instead?,0
A rigorous process to determine whether someone is approved for euthanasia already exists.,Should individuals sentenced to life in prison be allowed to choose death instead?,4
There is no inherent right to die.,Should individuals sentenced to life in prison be allowed to choose death instead?,1
The 'right to die' has not been recognised as a human right by the Universal Declaration of Human Rights.,Should individuals sentenced to life in prison be allowed to choose death instead?,4
"In 2014, Belgium set a precedent and widened the scope of the country's euthanasia law by allowing a Belgian serving a life sentence for murder and rape the right to an assisted suicide.",Should individuals sentenced to life in prison be allowed to choose death instead?,0
"As of March 2018, active human euthanasia is legal in the Netherlands, Belgium, Colombia, Luxembourg, and Canada.",Should individuals sentenced to life in prison be allowed to choose death instead?,0
The prison system would benefit from allowing inmates to choose death.,Should individuals sentenced to life in prison be allowed to choose death instead?,2
Allowing prisoners to make this choice would allow more money to be spent on improving conditions for other prisoners.,Should individuals sentenced to life in prison be allowed to choose death instead?,2
Prisons often do not meet even the basic standards for treatment and living conditions.,Should individuals sentenced to life in prison be allowed to choose death instead?,2
The cost of carrying out an inmate execution often exceeds the cost of life imprisonment.,Should individuals sentenced to life in prison be allowed to choose death instead?,3
Allowing prisoners to choose death reduces public pressure to improve the prison system.,Should individuals sentenced to life in prison be allowed to choose death instead?,2
"Rehabilitation and, where appropriate, reintegration should be a central goal of prisons, and allowing people to choose death is contrary to that.",Should individuals sentenced to life in prison be allowed to choose death instead?,6
There may be possible ways for inmates serving life sentences to be released.,Should individuals sentenced to life in prison be allowed to choose death instead?,6
Release in this situation is rare since almost all life sentences are life without parole.,Should individuals sentenced to life in prison be allowed to choose death instead?,4
Inmates may still have ways of making the most of life imprisonment.,Should individuals sentenced to life in prison be allowed to choose death instead?,6
Criminals should be forced to live with the consequences of their crimes.,Should individuals sentenced to life in prison be allowed to choose death instead?,1
There is little benefit to making criminals live with the consequences of their crimes.,Should individuals sentenced to life in prison be allowed to choose death instead?,5
"Since denying prisoners the right to choose death does not stop them from opting for suicide, they may not necessarily live with the consequences of their crimes.",Should individuals sentenced to life in prison be allowed to choose death instead?,3
Access to legal abortion improves the health and safety of women.,Pro-Life vs Pro-Choice: Should abortion be legal?,2
"When abortion is banned, many women who do not want a child seek out illegal abortions.",Pro-Life vs Pro-Choice: Should abortion be legal?,5
"If abortions will happen anyway, it is preferable to make them as safe as possible so at least the women survive the procedure.",Pro-Life vs Pro-Choice: Should abortion be legal?,2
"When abortion is banned, in practice this means that only women who can afford it can access safe abortion, since it is more expensive when illegal.",Pro-Life vs Pro-Choice: Should abortion be legal?,5
Any act will still happen regardless of whether it is legal or illegal. This is not a sufficient reason to legalize an activity which is wrong.,Pro-Life vs Pro-Choice: Should abortion be legal?,1
It wouldn't be reasonable to argue that we shouldn't regulate guns because people would buy guns illegally and from dangerous people anyway.,Pro-Life vs Pro-Choice: Should abortion be legal?,7
"The argument isn't just that illegal abortions will still happen, but that illegal abortions are dangerous for women, as opposed to guns which are still dangerous when legal.",Pro-Life vs Pro-Choice: Should abortion be legal?,5
"The government knows people will seek out illegal and potentially harmful drugs, but that is not a reason to lift the ban on them, making them easier to access.",Pro-Life vs Pro-Choice: Should abortion be legal?,7
"The war on drugs is an good example of why prohibition does not work. Criminalizing behavior may not deter that behavior as long as incentives exist
 and may only compound the problem without addressing the underlying cause.",Pro-Life vs Pro-Choice: Should abortion be legal?,0
Putting the child up for adoption is an alternative to abortion.,Pro-Life vs Pro-Choice: Should abortion be legal?,6
The question here is whether women should or should not have the right to choose abortion. The fact that adoption is a viable option does not automatically negate a right to abortion.,Pro-Life vs Pro-Choice: Should abortion be legal?,1
"If it is true that adoption is a viable option, then abortion is not the only option. If there is another ethical option besides abortion, with the benefit of saving lives, it should be valued over abortion.",Pro-Life vs Pro-Choice: Should abortion be legal?,6
"Believing one option to be ""better"" is not an argument against people having multiple options.",Pro-Life vs Pro-Choice: Should abortion be legal?,1
"Adoption is not a reasonable alternative given it requires women to go through pregnancy and childbirth, and bring a genetically related child into the world.",Pro-Life vs Pro-Choice: Should abortion be legal?,1
"Statistics regarding the number of abortions due to endangerment of mother's life back this up. Florida, 2015: 0.065%. UK,1968-2011: 0.006%. U.S. estimate: 1%. (links)",Pro-Life vs Pro-Choice: Should abortion be legal?,4
"The number of times something happens doesn't always make it less important. If you, or someone else you care about, were in that 1%, you would likely want them to be able to access to abortion.",Pro-Life vs Pro-Choice: Should abortion be legal?,0
"Even if in these cases abortion has a chance of saving the woman's life, abortion is always guaranteed to kill the fetus. We should not kill one person just to try to save another.",Pro-Life vs Pro-Choice: Should abortion be legal?,1
"In situations where pregnancy endangers a mother, the fetus is also likely in jeopardy. There for it is not as simple as exchanging one life for another, but rather opting to save one person versus allowing two to die.",Pro-Life vs Pro-Choice: Should abortion be legal?,3
"In most of the cases where pregnancy endangers a mother, there is a reasonable non-abortion option that could preserve the life of both mother and child.",Pro-Life vs Pro-Choice: Should abortion be legal?,6
"If childbirth poses a threat to the woman, the baby can be delivered via C-section.",Pro-Life vs Pro-Choice: Should abortion be legal?,6
"There are a large number of financial requirements of being pregnant and having a child, even if you plan to give it up for adoption. These costs may mean adoption is not a viable alternative for many women.",Pro-Life vs Pro-Choice: Should abortion be legal?,3
Government services should be available to intended adoptees to support them in this. The lack of this service is not grounds for termination.,Pro-Life vs Pro-Choice: Should abortion be legal?,6
"It is possible for women to research contraception and the likelihood of pregnancy before they have sex, such that they are aware of the risks.",Pro-Life vs Pro-Choice: Should abortion be legal?,3
No form of contraception is 100% effective.,Pro-Life vs Pro-Choice: Should abortion be legal?,3
Planned Parenthood states that the pill is only about 91% effective because it is difficult to maintain perfect use.,Pro-Life vs Pro-Choice: Should abortion be legal?,4
Contraceptives advertise that they are not 100% effective. Even though these devices or drugs decrease the likelihood of pregnancy they don't negate the responsibility for the risk of the action chosen.,Pro-Life vs Pro-Choice: Should abortion be legal?,4
Abstinence is always effective.,Pro-Life vs Pro-Choice: Should abortion be legal?,6
An abstinent woman can still be raped and become pregnant.,Pro-Life vs Pro-Choice: Should abortion be legal?,3
The primary role of sexual relations is reproduction. This is true in all species that reproduce by mating. The pleasure and bonding effect of a sexual relation is subservient to its purpose as a reproduction mechanism.,Pro-Life vs Pro-Choice: Should abortion be legal?,1
It is unreasonable to expect people to remain abstinent forever. There are people who may want to have sex lives but do not ever want to have children. For them there is no fail proof form of contraception.,Pro-Life vs Pro-Choice: Should abortion be legal?,0
Male vasectomies are both reversible and do not stop your body from producing sperm. It is one of the most highly-effective birth control measures while still maintaining the possibility of having children in the future.,Pro-Life vs Pro-Choice: Should abortion be legal?,6
"According to WHO, only 43% of women of reproductive age in less developed countries use modern contraceptive methods, and a wide gap in use is seen between the highest and lowest wealth quintiles (52% versus 35%, respectively).",Pro-Life vs Pro-Choice: Should abortion be legal?,4
"Contraception is not cheap or widely available in many developing countries around the world, even in some parts of the US and Europe.",Pro-Life vs Pro-Choice: Should abortion be legal?,4
"A small pack of condoms will cost you around 5€. Less developed countries may find contraception somewhat more expensive, however abortion procedures in those parts of the world are far more dangerous and costly, so prevention
 and abstinence are still the better options. To increase effectiveness and safety, one should compliment usage of contraception with proper sexual responsibility.",Pro-Life vs Pro-Choice: Should abortion be legal?,6
A lack of sex education in many conservative regions means that couples are often ill equipped to properly use contraceptives such as condoms.,Pro-Life vs Pro-Choice: Should abortion be legal?,3
"The solution for ignorance is to improve sex education, not implement a policy of allowing abortion.",Pro-Life vs Pro-Choice: Should abortion be legal?,6
People tend to not seek information when they are unaware that the information exists or is important.,Pro-Life vs Pro-Choice: Should abortion be legal?,3
Religious women are often taught that use of contraception is deeply immoral.,Pro-Life vs Pro-Choice: Should abortion be legal?,0
By this logic people are consenting to the risk of dying every time they cross the street. People aren't consenting to consequences.,Pro-Life vs Pro-Choice: Should abortion be legal?,7
Abortion has harmful mental and physical consequences for the woman involved.,Pro-Life vs Pro-Choice: Should abortion be legal?,5
Abortion increases the risk of placenta previa in later pregnancies (a life threatening condition for both the mother and her wanted pregnancy) by seven to fifteen fold.,Pro-Life vs Pro-Choice: Should abortion be legal?,0
Studies have shown that abortion has adverse psychological impacts on women.,Pro-Life vs Pro-Choice: Should abortion be legal?,4
"Humans can collaborate, meet, and communicate with unparalleled efficiency.",Has social media been good for humanity?,2
It is easy to maintain non day-to-day relationships.,Has social media been good for humanity?,2
"Social media algorithms designed to enhance the user's experience have inadvertently created deeply personalized Filter Bubbles. 
Information dissemination is calculated by user desire rather than objective necessity.",Has social media been good for humanity?,3
Confirmation bias is a major issue in today's society as it is pushed by the business models of Social media platforms.,Has social media been good for humanity?,5
The same systems that create echo chambers can be (ab)used to intentionally enter other peoples echo chambers. TED talk,Has social media been good for humanity?,4
Social media has negative health effects.,Has social media been good for humanity?,5
Exposure to online harassment - stressor to contend with for some resulting in some youths committing suicide (remember Ask.fm?),Has social media been good for humanity?,0
"Creates a reward system and withdrawals if you don't post on it or keep checking the platform for likes or new friends. People experience addictive effects when they are disconnected even for a few hours. Study: Social media addiction: Its impact, mediation, and intervention",Has social media been good for humanity?,4
Social media use during driving or walking across the road or operating dangerous equipment shows increase in injuries and deaths.,Has social media been good for humanity?,0
People have been shown to experience depression as a repercussion of social media.,Has social media been good for humanity?,3
"Instagram has been linked to teenagers' issues with mental health, exacerbating problems such as body image and FOMO.",Has social media been good for humanity?,0
Not necessarily. By joining groups related to sports you can actually be more active when sharing results.,Has social media been good for humanity?,0
"FOMO (Fear Of Missing Out) - stressor to contend with for some when they use social media. ""Everyone else is doing it and I'm not"" fear.",Has social media been good for humanity?,5
Social media can be beneficial when being a leisure-time activity.,Has social media been good for humanity?,0
"Social media, as a leisure-time activity displaces more healthy, social and productive activities like reading, spending time with friend and sport.",Has social media been good for humanity?,5
Many platforms e.g. facebook use a security opt-in model with new users being oblivious to the fact that a lot of personal information is publically exposed.,Has social media been good for humanity?,0
Users make the decision to put information out in such an insecure environment and should bear responsibility for the consequences of that decision.,Has social media been good for humanity?,3
"Risk is inherent in innovation. Driving a car puts you at risk of crashing. Using a credit card puts you at risk of having your identity stolen. As companies become better at reducing disaster, the efficiency, productivity, and quality of life gains are worth the risk of accidents.",Has social media been good for humanity?,7
Social media can be educational and informative.,Has social media been good for humanity?,2
Social media is a great way for families separated by distance to keep informed of the well being or otherwise of members of the family,Has social media been good for humanity?,2
Social media makes it easier for people to access information and news.,Has social media been good for humanity?,2
"Social media has potential as a collective learning experience. It is, in a sense, a giant classroom where people can learn from one another at their own pace and without the pressure of being graded.
",Has social media been good for humanity?,3
"Humans spend too long on social media, at the expense of other more valuable activities.",Has social media been good for humanity?,5
It’s a valuable aid for crime-solving.,Has social media been good for humanity?,2
"In states like Oregon, authorities have arrested people for drinking and driving after they bragged about it publicly on Facebook.",Has social media been good for humanity?,0
Social media allows for better discourse to take place.,Has social media been good for humanity?,2
You can discover new perspectives from people you ordinarily wouldn't talk with.,Has social media been good for humanity?,0
"Social media commentary systems have been designed for popularity, resulting in everybody writing in a more pointed, provocative way.
 This has harmed online discourse and increased polarization.",Has social media been good for humanity?,3
Social media distorts reality.,Has social media been good for humanity?,5
Social Media acts as a filter of what you let others see of your life. It perpetuates the illusion that everyone leads happy and succesful lives.,Has social media been good for humanity?,3
"If people do not take responsibility to do their own research independently of social media, social media can become an issue, but it is not a problem on its own.",Has social media been good for humanity?,6
"Social media can be manipulated and unreasonable positions can be made seem more popular, more broadly supported and legitimate than they really are.",Has social media been good for humanity?,5
"Social media is a vital tool for grassroots political organizing. (protest, advocacy groups, etc). This is beneficial to democracy.",Has social media been good for humanity?,2
Social media is a tool for radicalization.,Has social media been good for humanity?,5
"Individuals should have the autonomy to make their own decisions, as genetic engineering can bring them significant benefits.",Is cloning humans ethical?,2
The right to reproductive freedom already includes assisted reproductive technologies such as in-vitro fertilization. Cloning humans could be seen as another assisted reproductive technology.,Is cloning humans ethical?,7
"Vitro gametogenesis (IVG) is a new technology that could revolutionize reproductive medicine. If IVG is ethical, reproductive cloning should also be ethical.",Is cloning humans ethical?,7
Not all means of reproduction are legal. Surrogacy as a means of reproduction is illegal in many countries.,Is cloning humans ethical?,0
"Any use of cloning beyond family-planning purposes would most likely be cruel towards the clones. As nobody would have an emotional stake in the clone's life, nobody would defend their interests. 
The clones would, therefore, be taken advantage of or discriminated against.",Is cloning humans ethical?,5
"It is presumable that the person who has been cloned would have an emotional stake in the life of the clone, as they share the same DNA. Humans are predisposed to care for people who share their genes.",Is cloning humans ethical?,4
Human cloning is not safe. It may have unintended harmful consequences.,Is cloning humans ethical?,5
Genetic defects have been observed in otherwise healthy cloned animals.,Is cloning humans ethical?,0
Genetic defects have also been observed often enough in naturally reproduced animals.,Is cloning humans ethical?,0
Human cloning can be used to prevent harm by protecting newborns from genetic diseases.,Is cloning humans ethical?,6
"Cloning techniques, together with genetic engineering, could be used to cure hereditary diseases.",Is cloning humans ethical?,2
A potentially fatal blood disorder can be cured by fixing diseased genes in human embryos.,Is cloning humans ethical?,0
"People born with genetic disorders can still live rich and fulfilling lives, with their disorder becoming a part of their unique identity as a human being.",Is cloning humans ethical?,1
"Safety is important, but it's not relevant to the fundamental question of whether or not cloning is ethical.",Is cloning humans ethical?,1
Human cloning cannot be looked at in abstraction from the process of developing it because the former is contingent on the latter.,Is cloning humans ethical?,3
"In it's history and development, medicine used a lot of unorthodox practices to develop and gain higher understanding, practices such as using organs from animals to experiment and a lot of failed
 experiments on humans. The result was modern medicine which saves millions of lives annually. We now look at medicine in abstraction of all that.",Is cloning humans ethical?,0
"By cloning humans, we can improve the genetic quality of humankind.",Is cloning humans ethical?,2
Cloning humans opens up the possibility of producing replacement body parts from adult cells. This could increase the success rate of many treatments. (p.743),Is cloning humans ethical?,2
"It is dangerous for society to embrace the idea of a ""perfect human being"". This idea led to the advocacy of eugenics in Nazi Germany, as the perfect human was thought to be of Aryan race.",Is cloning humans ethical?,0
"Given the variety of modifications individuals could choose, cloning may lead to wider acceptance of individuals with greater differences.",Is cloning humans ethical?,2
"As with all things, it is likely that certain modifications will be more popular than others, which will create imbalances between individuals.",Is cloning humans ethical?,3
"Racism has been and continues to be justified through racist pseudo-science that claims that non-White people have lower IQs, limited capacities for reason, or smaller skulls than White people.",Is cloning humans ethical?,7
It is not the place for human beings to meddle with nature and evolution.,Is cloning humans ethical?,1
"By using therapeutic cloning, the life expectancy of the population could be drastically extended. This could have terrible consequences on climate change.",Is cloning humans ethical?,5
There are many multi-faith ethical limitations to research on human cloning.,Is cloning humans ethical?,1
"The Catholic Church is strongly against any form of human cloning, as they see cloning contrary to human dignity.",Is cloning humans ethical?,4
The Catholic Church has always had a turbulent history with scientific progress. This does not mean that advancements in science should stop for the church's sake.,Is cloning humans ethical?,0
Sometimes human intervention in nature and evolution is necessary and has very positive outcomes.,Is cloning humans ethical?,2
Science is being used to regenerate coral reefs that are dying because of climate change. These corals are extremely valuable for life on Earth.,Is cloning humans ethical?,2
The regeneration of coral reefs is only necessary because humans interfered with nature in the first place.,Is cloning humans ethical?,3
"An artificial general intelligence (AGI) should be created, because it could help to remedy problems of humanity.",Should an artificial general intelligence be created?,2
AGI should be created and studied for the sake of developing science.,Should an artificial general intelligence be created?,2
"The process of creating an AI would teach us many things about consciousness, computer science, and many other fields.",Should an artificial general intelligence be created?,2
The development of AGI could create an economic boom that could lead into a golden age for humanity.,Should an artificial general intelligence be created?,2
AGI will be the best tool we could possibly make.,Should an artificial general intelligence be created?,2
It would be exciting and in being so would enrich our lives.,Should an artificial general intelligence be created?,2
Creation of AGI has the potential of enabling an astronomical number of non-biological beings which would otherwise not exist.,Should an artificial general intelligence be created?,2
Bigger amount of rational thinking beings is not necessarily good.,Should an artificial general intelligence be created?,2
Future Humans and other sentient beings may suffer so much that it would be better if they did not come into existence.,Should an artificial general intelligence be created?,5
Transhumanism is the next step in evolution of wealthy humans. Poor humans will unlikely benefit from it.,Should an artificial general intelligence be created?,4
"The capacity for AGIs to colonize both in and out the solar system far exceeds that of humans. 
Any other impact which humans may have could be astronomically dwarfed by the prospect of populous future lives descending from AGIs.",Should an artificial general intelligence be created?,2
The consequences of developing AGI are unpredictable.,Should an artificial general intelligence be created?,5
"The AGI Safety problem is mathematically identical to that of the Halting Problem  in computer science. 
It is fundamentally impossible to discern the outcome, intentions and wisdom of creating an AGI ahead of doing so. ",Should an artificial general intelligence be created?,7
